Num,,Source_GR,Name_EN,Source_EN,Last revision,Created date,Quick look name,Description_EN,Description_GR,Type,Layer_Name,server,updated
,Αρχαία Θέατρα,Οργανισμός Κτηματολογίου και Χαρτογραφήσεων Ελλάδας,Ancient Theaters,Hellenic Mapping and Cadastral Organization,12/06/2012,06/12/2012,Ancient_Theaters,"The dataset contains the location of ancient theaters and conservatories of the country as
 recorded by the non profit assosiation ""Diazoma"".","Σημειακό σύνολο δεδομένων με τις θέσεις των αρχαίων θεάτρων και ωδείων της χώρας, όπως 
 καταγράφονται από το μη κερδοσοπικό Σωματείο ""Διάζωμα"", το οποίο λειτουργεί για την ανάδειξη 
 και την προστασία τους.",WMS,eygep:ancthe,http://www1.okxe.gr/geoserver/wms,yes
,Χρήσεις γης CORINE 2000,Οργανισμός Κτηματολογίου και Χαρτογραφήσεων Ελλάδας,CORINE Land Cover 2000,Hellenic Mapping and Cadastral Organization,,27/11/2012,Corine_2000,Polygons for the CORINE Land Cover 2000 program,Πολύγωνα κάλυψης γης του προγράμματος CORINE Land Cover (2000).,WMS,eygep:clcg00,http://www1.okxe.gr/geoserver/wms,yes
,Σταθμοί και στάσεις Οργανισμού Αστικών Συγκοινωνιών Αθήνας (ΟΑΣΑ),Οργανισμός Αστικών Συγκοινωνιών Αθηνών,Stations and stops of public transportation in Athens (OASA),Athens Urban Transport Organisation S.A.,3/21/2016,19/01/2012,Stations_and _stops_of_public_transportation_in_Athens_OASA,"The dataset includes the stops of public transpoortation. It contains information about bus, subway, metro and tram stops and stations. The accuracy of the dataset is ±20m in urban areas and ±50m in semi-urban areas.","Περιέχονται τα δρομολόγια Αστικής Συγκοινωνίας για την Αθήνα. Τα δεδομένα περιλαμβάνουν τις στάσεις για λεωφορεία, τρόλευ, μετρό, τραμ, ηλεκτρικό σιδηρόδρομο και προαστιακό σιδηρόδρομο. Η ακρίβεια αποτύπωσης στάσεων μπορεί να είναι, ενδεικτικά, της τάξης των ±20 μέτρων στις αστικές περιοχές (όπου υπάρχουν σαφή και σχετικά μικρού μεγέθους Ο.Τ.) και περισσότερο από ±50 μέτρων σε ημιαστικές περιοχές (όπου τα Ο.Τ. δεν είναι σαφή ή είναι πολύ μεγάλα).",WMS,eygep:oasast,http://www1.okxe.gr/geoserver/wms,yes
7,Το δίκτυο NATURA 2000 και προστατευόμενες περιοχές,"Υπουργείο Παραγωγικής Ανασυγκρότησης, Περιβάλλοντος και Ενέργειας",Natura 2000 Network and protected areas,"Ministry of Productive Reconstruction, Environment and Energy",04/11/2015,20/10/2011,Natura_2000,"The Natura 2000 Network is a European Ecological Network of sites which host natural habitat types and habitats of species that are important at a European level. Today Greece has designated 202 Special Protection Areas (SPAs) and 241 Sites of Community Importance (SCI), two of which are still under consideration. The data available constitute version 29 (v.29) which resulted after update of the Natura 2000 database in May 2011. The changes to the data are documented in the document ʻUPDATE OF THE DATABASE OF NATURA 2000 - MAY 2011ʼ (http://www.ypeka.gr/LinkClick.aspx?fileticket=h4RzmKEMXHM% 3d & tabid = 504 & language = el-GR) .The designation species of Special Protection Areas are recorded in the relevant document ().","Το Δίκτυο Natura 2000 αποτελεί ένα Ευρωπαϊκό Οικολογικό Δίκτυο περιοχών, οι οποίες φιλοξενούν φυσικούς τύπους οικοτόπων και οικοτόπους ειδών που είναι σημαντικοί σε ευρωπαϊκό επίπεδο. Η Ελλάδα έχει χαρακτηρίσει σήμερα 202 Ζώνες Ειδικής Προστασίας (ΖΕΠ) και 241 Τόπους Κοινοτικής Σημασίας (ΤΚΣ), εκ των οποίων οι δύο είναι ακόμη προτεινόμενοι.Τα διατιθέμενα δεδομένα αποτελούν την έκδοση 29 (v.29) η οποία προέκυψε μετά από την επικαιροποίηση της βάσης δεδομένων Natura 2000 τον Μάιο του 2011. Οι αλλαγές στα δεδομένα τεκμηριώνονται στο έγγραφο ""ΕΠΙΚΑΙΡΟΠΟΙΗΣΗ ΤΗΣ ΒΑΣΗΣ ∆Ε∆ΟΜΕΝΩΝ ΤΟΥ NATURA 2000 - ΜΑΪΟΣ 2011"" (http://www.ypeka.gr/LinkClick.aspx?fileticket=h4RzmKEMXHM%3d&tabid=504&language=el-GR).Τα είδη χαρακτηρισμού των Ζωνών Ειδικής Προστασίας καταγράφονται στο σχετικό έγγραφο (http://www.ypeka.gr/LinkClick.aspx?fileticket=iIe61%2fEm2Mc%3d&tabid=432).",WMS,eygep:natgr_v29,http://www1.okxe.gr/geoserver/wms,yes
28,Ακτογραμμή,Υπουργείο Εσωτερικών και Διοικητικής Ανασυγκρότησης,Coastline,Ministry of the Interior and Administrative Reconstruction,04/11/2015,14/10/2011,Coastline,This dataset contains the coastline of Greece and the delimitation of its borders.,Περιλαμβάνεται η ακτογραμμή της Ελλάδας και οριοθετούνται τα σύνορά της.,WMS,eygep:aktoktae,http://www1.okxe.gr/geoserver/wms,yes
25,Εθνικοί Δρυμοί,"Υπουργείο Παραγωγικής Ανασυγκρότησης, Περιβάλλοντος και Ενέργειας",National Forests,"Ministry of Productive Reconstruction, Environment and Energy",04/11/2015,20/10/2011,National_Forests,This dataset contains the boundaries of the core and peripheral zone of National Forests as established and demarcated based on the data of Forest Services.,Περιλαμβάνονται τα όρια πυρήνα και περιφερειακής ζώνης των Εθνικών Δρυμών όπως έχουν θεσμοθετηθεί και οριοθετήθηκαν με τα στοιχεία των Δασικών Υπηρεσιών.,WMS,eygep:ethdrm,http://www1.okxe.gr/geoserver/wms,yes
27,Διανομή Φύλλων Χάρτου της ΓΥΣ κλίμακας 1:5000,Οργανισμός Κτηματολογίου και Χαρτογραφήσεων Ελλάδας,Distribution of Map Sheets by the HMGS of a 1:5000 scale,Hellenic Mapping and Cadastral Organization,04/11/2015,20/10/2011,Distribution_of_Map_Sheets,This dataset contains the distribution of Map Sheets by the Hellenic Military Geographical Srevice (HMGS). The map scale is 1:5000 scale.,Περιέχεται η διανομή φύλλων χάρτου της Γεωγραφικής Υπηρεσίας Ελλάδας. Η κλίμακα του χάρτη είναι 1:5000.,WMS,eygep:gysmsd5k,http://www1.okxe.gr/geoserver/wms,yes
21,Όρια Δήμων (Καλλικράτης),Οργανισμός Κτηματολογίου και Χαρτογραφήσεων Ελλάδας,Municipality boundaries (Kallikratis),Hellenic Mapping and Cadastral Organization,04/11/2015,28/06/2010,Municipality_boundaries_Kallikratis,"This dataset contains the boundaries of the Municipalities of the country, in accordance with the Kallikratis programme. The present file constitutes a corrected version (version v1.1) of the as of 28.6.2010 posted version v1.0.","Περιέχονται τα όρια των Δήμων της χώρας, σύμφωνα με το πρόγραμμα Καλλικράτης. Το παρόν αρχείο αποτελεί διορθωμένη εκδοχή (έκδοση v1.1) της από 28/06/2010 αναρτημένης έκδοσης v1.0.",WMS,eygep:kaldim,http://www1.okxe.gr/geoserver/wms,yes
22,Οικισμοί,Υπουργείο Εσωτερικών και Διοικητικής Ανασυγκρότησης,Settlements,Ministry of the Interior and Administrative Reconstruction,25/09/2012,25/09/2012,Settlements,"The Settlements of the country. The dataset was creatde by the Spatial Analysis, GIS and Thematic Mapping Laboratory, of the University of Thessaly on 2012.","Σημειακό αρχείο με τους οικισμούς της χώρας. Το αρχείο παραδόθηκε στο Υπουργείο Εσωτερικών, απο το Εργαστήριο Χωρικής Ανάλυσης, GIS και Θεματικής Χαρτογραφίας, του Πανεπιστημίου Θεσσαλίας το 2012",WMS,kose:oikismoi,http://geonet.ypes.gr:8080/geoserver/wms,yes
22,Οικισμοί,Υπουργείο Εσωτερικών και Διοικητικής Ανασυγκρότησης,Settlements,Ministry of the Interior and Administrative Reconstruction,25/09/2012,25/09/2012,Settlements,"The Settlements of the country. The dataset was creatde by the Spatial Analysis, GIS and Thematic Mapping Laboratory, of the University of Thessaly on 2012.","Σημειακό αρχείο με τους οικισμούς της χώρας. Το αρχείο παραδόθηκε στο Υπουργείο Εσωτερικών, απο το Εργαστήριο Χωρικής Ανάλυσης, GIS και Θεματικής Χαρτογραφίας, του Πανεπιστημίου Θεσσαλίας το 2012",WFS,kose:oikismoi,http://geonet.ypes.gr:8080/geoserver/wfs,yes
,Χρήσεις γης CORINE 1990,Οργανισμός Κτηματολογίου και Χαρτογραφήσεων Ελλάδας,CORINE Land Cover 1990,Hellenic Mapping and Cadastral Organization,,01/01/1990,Corine_90,Polygons for the CORINE Land Cover 1990 program,Πολύγωνα κάλυψης γης του προγράμματος CORINE Land Cover (1990).,WMS,eygep:clcg90,http://www1.okxe.gr/geoserver/wms,
,Αστυνομικά Τμήματα,Υπουργείο Προστασίας του Πολίτη,Police Stations,Ministry of Citizen Protection,4/14/2011,12/10/2007,Police_Stations,"Point location of the Poslice Stations, including postal addresses.","Σημειακό αρχείο με τις θέσεις των Αστυνομικών Τμημάτων. Περιλαμβάνονται και οι ταχυδρομικές 
 διευθύνσεις.",WMS,eygep:elasat,http://www1.okxe.gr/geoserver/wms,
,Γεωθερμικά Πεδία,"Υπουργείο Παραγωγικής Ανασυγκρότησης, Περιβάλλοντος και Ενέργειας",Underground Geothermal fields,"Ministry of Productive Reconstruction, Environment and Energy",,26/10/2012,Underground_Geothermal_fields,"Certain and potential underground geothermal fields, as defined by the current legislation (3175/03).","Πιθανά και βεβαιωμένα Γεωθερμικά Πεδία όπως αυτά καθορίζονται σύμφωνα με την ισχύουσα 
 νομοθεσία περί αξιοποίησης γεωθερμικού δυναμικού (Ν. 3175/03).",WMS,eygep:geotherm,http://www1.okxe.gr/geoserver/wms,
,Γραμμές ΑΤΤΙΚΟ ΜΕΤΡΟ,"Υπουργείο Οικονομίας, Υποδομών, Ναυτιλίας και Τουρισμού",Metro Athens Routes,"Ministry of Economy, Development and Tourism",,01/01/2009,Routes_Metro_Athens,Lines of the current network of the metro of Athens.,Άξονες του υφιστάμενου δικτύου γραμμών του μετρό της Αθήνας.,WMS,eygep:metroln,http://www1.okxe.gr/geoserver/wms,
,Στάσεις ΑΤΤΙΚΟ ΜΕΤΡΟ,"Υπουργείο Οικονομίας, Υποδομών, Ναυτιλίας και Τουρισμού",Stops of Athens' Metro Network,"Ministry of Economy, Development and Tourism",12/02/2010,01/01/2009,Stops_Metro_Nework,The stations/stops of the Metro network of Athens.,"Άξονες του υφιστάμενου δικτύου γραμμών του μετρό της Αθήνας.Σταθμοί του υφιστάμενου 
 δικτύου μετρό της Αθήνας",WMS,eygep:metrost,http://www1.okxe.gr/geoserver/wms,
,Οδικό Δίκτυο ΔΜΕΟ,"Υπουργείο Οικονομίας, Υποδομών, Ναυτιλίας και Τουρισμού",Road Network,"Ministry of Economy, Development and Tourism",11/18/2010,23/02/2009,Road_Network,"The dataset contains the National (1st, 2nd and 3rd order) and Local (1st and 2nd order) road network of Greece.","Γεωγραφική Βάση Δεδομένων του Εθνικού (Πρωτεύον-Δευτερεύον-Τριτεύον) και Επαρχιακού 
 (Πρωτεύον-Δευτερεύον) Οδικού Δικτύου της χώρας.Η κατηγοριοποίηση του οδικού δικτύου έγινε 
 με βάση τις αντίστοιχες αποφάσεις χαρακτηρισμού και η Βάση διαθέτει τεκμιρίωση και metadata 
 .Το έργο ολοκληρώθηκε τον Μάρτιο του 2010",WMS,eygep:rdndmeo,http://www1.okxe.gr/geoserver/wms,
29,"Αεροφωτογραφίες
",Κτηματολόγιο Α.Ε.,Aerial Photos,National Cadastre and Mapping Agency S.A.,10/19/2011,19/10/2011,Orthophotos,The web service offers viewing capabilities for orthophotos with GSD 50cm for the entire country and fully orthorectified orthophotos with GSD 20cm for urban / built-up areas of the country.,Η διαδικτυακή υπηρεσία προσφέρει υπηρεσίες θέασης σε ορθοφωτογραφίες με GSD 50cm για το σύνολο της χώρας και πλήρως ορθοανηγμένες ορθοφωτογραφίες με GSD 20cm για αστικές / δομημένες περιοχές της χώρας.,WMS,KTBASEMAP,http://gis.ktimanet.gr/wms/wmsopen/wmsserver.aspx,
56,Γενικό Πολεοδομικό Σχέδιο Αττικης - Χρήσεις Γης,Οργανισμός Ρυθμιστικού Σχεδίου και Προστασίας Περιβάλλοντος Αθήνας (ΟΡΣΑ) ,"Land Use, Area of Athens",Organisation of Planning and Environmental Protection of Athens,20/05/2014,20/05/2014,land_use_Athens,The land use information derives fom the Master Urban Planning desing of the Organisation of Planning and Environmental Protection of Athens,Οι χρήσεις γης προέρχονται από Γενικά Πολεοδομικά Σχέδια που διαχειρίζεται ο ΟΡΣΑ,WMS,orsa:all,http://gis.organismosathinas.gr/geoserver/wms,
,Δεδομένα Αιολικού Δυναμικού (h100),Ρυθμιστική Αρχή Ενέργειας,Wind Potential (h100),Regulatory Authority for Energy (RAE),,,wind_potential_h100,"The data regard the mean yearly wind speed (per 10 minutes)  on height of 100 meters above the ground. The speed values derive from processing of the raw observations of the sensors which are placed on 160-170 ""webs"" throughout the country. During the processing of the data a model for mass preservation is used.","Τα δεδομένα αφορούν σε μέσες ετήσιες ταχύτητες ανέμου (ανά δεκάλεπτο),  σε απόστηση 100 μέτρα απο το έδαφος. Οι τιμές ταχυτήτων προκύπτουν μέσω επεξεργασίας των πρωτογενών δεδομένων μετρήσεων από αισθητήρες οι οποίοι είναι τοποθετημένοι σε 160-170 ιστούς στο σύνολο της χώρας. Κατά την επεξεργασία χρησιμοποιούνται μοντέλο διατήρησης μάζας και διόρθωση οριακού στρώματος.",WMS,rae_status:Aiolikos_h100,http://www.rae.gr/geoserver/wms,
,Δεδομένα Αιολικού Δυναμικού (h120),Ρυθμιστική Αρχή Ενέργειας,Wind Potential (h120),Regulatory Authority for Energy (RAE),,,wind_potential_h120,"The data regard the mean yearly wind speed (per 10 minutes)  on height of 120 meters above the ground. The speed values derive from processing of the raw observations of the sensors which are placed on 160-170 ""webs"" throughout the country. During the processing of the data a model for mass preservation is used.","Τα δεδομένα αφορούν σε μέσες ετήσιες ταχύτητες ανέμου (ανά δεκάλεπτο),  σε απόστηση 120 μέτρα απο το έδαφος. Οι τιμές ταχυτήτων προκύπτουν μέσω επεξεργασίας των πρωτογενών δεδομένων μετρήσεων από αισθητήρες οι οποίοι είναι τοποθετημένοι σε 160-170 ιστούς στο σύνολο της χώρας. Κατά την επεξεργασία χρησιμοποιούνται μοντέλο διατήρησης μάζας και διόρθωση οριακού στρώματος.",WMS,rae_status:Aiolikos_h120,http://www.rae.gr/geoserver/wms,
,Δεδομένα Αιολικού Δυναμικού (h80),Ρυθμιστική Αρχή Ενέργειας,Wind Potential (h80),Regulatory Authority for Energy (RAE),,,wind_potential_h80,"The data regard the mean yearly wind speed (per 10 minutes)  on height of 80 meters above the ground. The speed values derive from processing of the raw observations of the sensors which are placed on 160-170 ""webs"" throughout the country. During the processing of the data a model for mass preservation is used.","Τα δεδομένα αφορούν σε μέσες ετήσιες ταχύτητες ανέμου (ανά δεκάλεπτο),  σε απόστηση 80 μέτρα απο το έδαφος. Οι τιμές ταχυτήτων προκύπτουν μέσω επεξεργασίας των πρωτογενών δεδομένων μετρήσεων από αισθητήρες οι οποίοι είναι τοποθετημένοι σε 160-170 ιστούς στο σύνολο της χώρας. Κατά την επεξεργασία χρησιμοποιούνται μοντέλο διατήρησης μάζας και διόρθωση οριακού στρώματος.",WMS,rae_status:Aiolikos_h80,http://www.rae.gr/geoserver/wms,
,Μικροί Υδροηλεκτρικοί Σταθμοί,Ρυθμιστική Αρχή Ενέργειας,Small Hydroelectric Power Stations,Regulatory Authority for Energy (RAE),,,Small_Hydroelectric_Power_Stations,"Point location of small hydroelectric power stations with additional information, as derived from the submitted applications. ","Θέσεις εγκατάστασης μικρών υδροηλεκτρικών σταθμών.Τα δεδομένα απεικονίζονται ομαδοποιημένα ανά αριθμό αίτησης (ΑΑ) και αριθμό μητρώου (ΑΜ), ως σύνθετες γεωμετρίες (πολυσημεία). Για κάθε σταθμό καταγράφονται το /τα σημείο/α υδροληψίας, η θέση του σταθμού παραγωγής καθώς και πληροφορίες που αφορούν στην εξέλιξη του έργου (λ.χ. υπό αξιολόγηση, άδεια παραγωγής, ανάκληση/ απόρριψη αίτησης, άδεια εγκατάστασης, άδεια λειτουργίας), τον κωδικό αίτησης, τον τύπο του, την ισχύ του και την γεωγραφική του θέση. Τα δεδομένα καλύπτουν αιτήσεις που έχουν υποβληθεί για το σύνολο της ελληνικής επικράτειας. Πρόκειται για Υ/Η σταθμούς με άδεια παραγωγής",WFS,rae_status:V_HYDRO_GROUPED_ALL,http://www.rae.gr/geoserver/wfs,
,Μικροί Υδροηλεκτρικοί Σταθμοί,Ρυθμιστική Αρχή Ενέργειας,Small Hydroelectric Power Stations,Regulatory Authority for Energy (RAE),,,Small_Hydroelectric_Power_Stations,"Point location of small hydroelectric power stations with additional information, as derived from the submitted applications. ","Θέσεις εγκατάστασης μικρών υδροηλεκτρικών σταθμών.Τα δεδομένα απεικονίζονται ομαδοποιημένα ανά αριθμό αίτησης (ΑΑ) και αριθμό μητρώου (ΑΜ), ως σύνθετες γεωμετρίες (πολυσημεία). Για κάθε σταθμό καταγράφονται το /τα σημείο/α υδροληψίας, η θέση του σταθμού παραγωγής καθώς και πληροφορίες που αφορούν στην εξέλιξη του έργου (λ.χ. υπό αξιολόγηση, άδεια παραγωγής, ανάκληση/ απόρριψη αίτησης, άδεια εγκατάστασης, άδεια λειτουργίας), τον κωδικό αίτησης, τον τύπο του, την ισχύ του και την γεωγραφική του θέση. Τα δεδομένα καλύπτουν αιτήσεις που έχουν υποβληθεί για το σύνολο της ελληνικής επικράτειας. Πρόκειται για Υ/Η σταθμούς με άδεια παραγωγής",WMS,rae_status:V_HYDRO_GROUPED_ALL,http://www.rae.gr/geoserver/wms,
,Αιολικοί Σταθμοί,Ρυθμιστική Αρχή Ενέργειας,Wind Farms,Regulatory Authority for Energy (RAE),,,Wind_Farms,"Polygons of wind farm parcels with additional information, as derived from the submitted applications.","Πολύγωνα γηπέδων εγκατάστασης αιολικών σταθμών, όπως αυτά προκύπτουν από τις αιτήσεις για χορήγηση άδειας παραγωγής. Κάθε πολύγωνο συνοδεύεται από πληροφορίες που αφορούν στην εξέλιξη του έργου (λ.χ. υπό αξιολόγηση, άδεια παραγωγής, ανάκληση/απόρριψη αίτησης, άδεια εγκατάστασης, άδεια λειτουργίας), τον κωδικό αίτησης, την ισχύ και την γεωγραφική θέση του σταθμού. Τα δεδομένα καλύπτουν αιτήσεις που έχουν υποβληθεί για το σύνολο της ελληνικής επικράτειας.
Περιλαμβάνει πολύγωνα με άδεια παραγωγής.",WFS,rae_status:V_SDI_R_AIOLIKA_ALL,http://www.rae.gr/geoserver/wfs,
,Αιολικοί Σταθμοί,Ρυθμιστική Αρχή Ενέργειας,Wind Farms,Regulatory Authority for Energy (RAE),,,Wind_Farms,"Polygons of wind farm parcels with additional information, as derived from the submitted applications.","Πολύγωνα γηπέδων εγκατάστασης αιολικών σταθμών, όπως αυτά προκύπτουν από τις αιτήσεις για χορήγηση άδειας παραγωγής. Κάθε πολύγωνο συνοδεύεται από πληροφορίες που αφορούν στην εξέλιξη του έργου (λ.χ. υπό αξιολόγηση, άδεια παραγωγής, ανάκληση/απόρριψη αίτησης, άδεια εγκατάστασης, άδεια λειτουργίας), τον κωδικό αίτησης, την ισχύ και την γεωγραφική θέση του σταθμού. Τα δεδομένα καλύπτουν αιτήσεις που έχουν υποβληθεί για το σύνολο της ελληνικής επικράτειας.
Περιλαμβάνει πολύγωνα με άδεια παραγωγής.",WMS,rae_status:V_SDI_R_AIOLIKA_ALL,http://www.rae.gr/geoserver/wms,
,Ανεμογεννήτριες Αιολικών Και Υβριδικών Σταθμών,Ρυθμιστική Αρχή Ενέργειας,Position of Windmills on Wind Farms or Hybrid Power Stations,Regulatory Authority for Energy (RAE),,,Position_of_Windmills_on_Wind_Farms_or_Hybrid_Power_Stations,"Point location of wind mills, wind farms and hybrid power stations with additional information, as derived from the submitted applications.","Οι Θέσεις εγκατάστασης ανεμογεννητριών αιολικών και υβριδικών σταθμών. Για κάθε ανεμογεννήτρια καταγράφονται η προτεινόμενη θέση εγκατάστασης καθώς και πληροφορίες που αφορούν στον τύπο, την ισχύ, το ύψος του πυλώνα, την διάμετρο του δρομέα και τον συνολικό αριθμό ανεμογεννητριών εντός του σταθμού. Τα δεδομένα σχετίζονται άμεσα με το στάδιο εξέλιξης της αίτησης του αιολικού σταθμού στον οποίο αναφέρονται και καλύπτουν αιτήσεις που έχουν υποβληθεί για το σύνολο της ελληνικής επικράτειας. Πρόκειται για ανεμογεννήτριες με άδεια παραγωγής",WFS,rae_status:V_SDI_R_ANEMOGENNHTRIES_GEO,http://www.rae.gr/geoserver/wfs,
